{
  "schema_version": 3,
  "parameter_occurrence_dispositions": [
    {
      "id": "download_dir_scr",
      "path": "lib/bash/help/help_submit_download_fastqs.sh",
      "symbol": "help_submit_download_fastqs",
      "parameter": "dir_scr",
      "disposition": "enrolled_member"
    },
    {
      "id": "install_dry_run",
      "path": "install/scripts/install_envs_entrypoint.sh",
      "symbol": "<file>",
      "parameter": "dry_run",
      "disposition": "unresolved_review_candidate"
    },
    {
      "id": "install_env_nam",
      "path": "install/scripts/install_envs_entrypoint.sh",
      "symbol": "<file>",
      "parameter": "env_nam",
      "disposition": "unresolved_review_candidate"
    },
    {
      "id": "source_helpers_dir_fnc_88",
      "path": "lib/bash/core/source_helpers.sh",
      "symbol": "_source_helper_resolve",
      "parameter": "dir_fnc",
      "disposition": "non_applicable_same_name"
    },
    {
      "id": "source_helpers_dir_fnc_276",
      "path": "lib/bash/core/source_helpers.sh",
      "symbol": "source_helpers",
      "parameter": "dir_fnc",
      "disposition": "enrolled_member"
    },
    {
      "id": "align_dir_scr",
      "path": "lib/bash/help/help_submit_align_fastqs.sh",
      "symbol": "help_submit_align_fastqs",
      "parameter": "dir_scr",
      "disposition": "non_applicable_same_name"
    },
    {
      "id": "calculate_dir_scr",
      "path": "lib/bash/help/help_submit_calculate_scaling_factor.sh",
      "symbol": "help_submit_calculate_scaling_factor",
      "parameter": "dir_scr",
      "disposition": "non_applicable_same_name"
    },
    {
      "id": "compute_dir_scr",
      "path": "lib/bash/help/help_submit_compute_signal.sh",
      "symbol": "help_submit_compute_signal",
      "parameter": "dir_scr",
      "disposition": "non_applicable_same_name"
    },
    {
      "id": "convert_dir_scr",
      "path": "lib/bash/help/help_submit_convert_bam_bed.sh",
      "symbol": "help_submit_convert_bam_bed",
      "parameter": "dir_scr",
      "disposition": "non_applicable_same_name"
    },
    {
      "id": "filter_dir_scr",
      "path": "lib/bash/help/help_submit_filter_alignments.sh",
      "symbol": "help_submit_filter_alignments",
      "parameter": "dir_scr",
      "disposition": "non_applicable_same_name"
    },
    {
      "id": "qsort_dir_scr",
      "path": "lib/bash/help/help_submit_qsort_bam.sh",
      "symbol": "help_submit_qsort_bam",
      "parameter": "dir_scr",
      "disposition": "non_applicable_same_name"
    },
    {
      "id": "trim_dir_scr",
      "path": "lib/bash/help/help_submit_trim_fastqs.sh",
      "symbol": "help_submit_trim_fastqs",
      "parameter": "dir_scr",
      "disposition": "non_applicable_same_name"
    },
    {
      "id": "floor_skp_pfx",
      "path": "src/protocol_chipseq_signal_norm/cli/compute_input_floor.py",
      "symbol": "parse_args",
      "parameter": "skp_pfx",
      "disposition": "non_applicable_same_name"
    },
    {
      "id": "floor_qntl_nz",
      "path": "src/protocol_chipseq_signal_norm/cli/compute_input_floor.py",
      "symbol": "parse_args",
      "parameter": "qntl_nz",
      "disposition": "non_applicable_same_name"
    },
    {
      "id": "floor_coef",
      "path": "src/protocol_chipseq_signal_norm/cli/compute_input_floor.py",
      "symbol": "parse_args",
      "parameter": "coef",
      "disposition": "non_applicable_same_name"
    },
    {
      "id": "floor_eps",
      "path": "src/protocol_chipseq_signal_norm/cli/compute_input_floor.py",
      "symbol": "parse_args",
      "parameter": "eps",
      "disposition": "non_applicable_same_name"
    },
    {
      "id": "floor_mode_nz",
      "path": "src/protocol_chipseq_signal_norm/cli/compute_input_floor.py",
      "symbol": "parse_args",
      "parameter": "mode_nz",
      "disposition": "non_applicable_same_name"
    },
    {
      "id": "floor_floor",
      "path": "src/protocol_chipseq_signal_norm/cli/compute_input_floor.py",
      "symbol": "parse_args",
      "parameter": "floor",
      "disposition": "non_applicable_same_name"
    },
    {
      "id": "floor_siz_bin",
      "path": "src/protocol_chipseq_signal_norm/cli/compute_input_floor.py",
      "symbol": "parse_args",
      "parameter": "siz_bin",
      "disposition": "non_applicable_same_name"
    },
    {
      "id": "floor_siz_gen",
      "path": "src/protocol_chipseq_signal_norm/cli/compute_input_floor.py",
      "symbol": "parse_args",
      "parameter": "siz_gen",
      "disposition": "non_applicable_same_name"
    },
    {
      "id": "merge_dp",
      "path": "src/protocol_chipseq_signal_norm/cli/merge_bins_bdg.py",
      "symbol": "parse_args",
      "parameter": "dp",
      "disposition": "unresolved_review_candidate"
    }
  ],
  "surfaces": [
    {
      "id": "compute_input_floor_cli",
      "path": "src/protocol_chipseq_signal_norm/cli/compute_input_floor.py",
      "symbol": "parse_args",
      "language": "python",
      "kind": "installed_help",
      "audience": "command_user",
      "availability": "installed",
      "required_runtime_facts": "complete",
      "status": "accepted_pilot"
    },
    {
      "id": "compute_input_floor_callable",
      "path": "src/protocol_chipseq_signal_norm/cli/compute_input_floor.py",
      "symbol": "compute_input_floor",
      "language": "python",
      "kind": "callable_documentation",
      "audience": "python_caller",
      "availability": "installed",
      "required_runtime_facts": "direct_call_contract",
      "status": "accepted_pilot"
    },
    {
      "id": "compute_input_floor_design",
      "path": "docs/design/compute_input_floor.md",
      "symbol": "document",
      "language": "markdown",
      "kind": "public_design",
      "audience": "design_reviewer",
      "availability": "public_repository",
      "required_runtime_facts": "extended_derivation",
      "status": "accepted_pilot"
    },
    {
      "id": "combine_parts_scaling_factor_help",
      "path": "lib/bash/help/help_combine_parts_scaling_factor.sh",
      "symbol": "help_combine_parts_scaling_factor",
      "language": "shell",
      "kind": "installed_help",
      "audience": "command_user",
      "availability": "installed",
      "required_runtime_facts": "complete",
      "status": "accepted_pilot"
    },
    {
      "id": "execute_compute_signal_help",
      "path": "lib/bash/help/help_execute_compute_signal.sh",
      "symbol": "help_execute_compute_signal",
      "language": "shell",
      "kind": "installed_help",
      "audience": "command_user",
      "availability": "installed",
      "required_runtime_facts": "complete",
      "status": "registered"
    },
    {
      "id": "execute_calculate_scaling_factor_help",
      "path": "lib/bash/help/help_execute_calculate_scaling_factor.sh",
      "symbol": "help_execute_calculate_scaling_factor",
      "language": "shell",
      "kind": "installed_help",
      "audience": "command_user",
      "availability": "installed",
      "required_runtime_facts": "complete",
      "status": "registered"
    },
    {
      "id": "compute_pseudo_cli",
      "path": "src/protocol_chipseq_signal_norm/cli/compute_pseudo.py",
      "symbol": "parse_args",
      "language": "python",
      "kind": "installed_help",
      "audience": "command_user",
      "availability": "installed",
      "required_runtime_facts": "complete",
      "status": "registered"
    },
    {
      "id": "compute_pseudo_callable",
      "path": "src/protocol_chipseq_signal_norm/cli/compute_pseudo.py",
      "symbol": "combine_pseudo_sym",
      "language": "python",
      "kind": "callable_documentation",
      "audience": "python_caller",
      "availability": "installed",
      "required_runtime_facts": "direct_call_contract",
      "status": "registered"
    },
    {
      "id": "compute_pseudo_deeptools_cli",
      "path": "src/protocol_chipseq_signal_norm/cli/compute_pseudo_deeptools.py",
      "symbol": "parse_args",
      "language": "python",
      "kind": "installed_help",
      "audience": "command_user",
      "availability": "installed",
      "required_runtime_facts": "complete",
      "status": "registered"
    }
  ],
  "token_quoting": {
    "languages": ["python", "shell"],
    "included_contexts": ["ordinary_explanatory_prose"],
    "included_objects": [
      "option",
      "identifier",
      "sentinel",
      "value",
      "complete_inline_interface_expression"
    ],
    "excluded_contexts": [
      "usage",
      "fenced_command",
      "example",
      "formula",
      "structured_grammar"
    ],
    "ambiguous": "human_review",
    "automatic_rewrite": false
  },
  "option_category_precedence": [
    "help_reporting",
    "preview_no_write",
    "execution_environment_resources",
    "operation_discriminant",
    "inputs",
    "output_targets",
    "output_lifecycle_cleanup",
    "mode_specific",
    "formatting",
    "logging_job_names",
    "scheduler_parallel"
  ],
  "parameter_families": [
    {
      "id": "shared_csv_fil_in",
      "parameter": "csv_fil_in",
      "canonical_core": "Comma-separated list of input file paths.",
      "members": [
        {
          "surface_id": "lib/bash/help/help_submit_compute_signal.sh::help_submit_compute_signal",
          "path": "lib/bash/help/help_submit_compute_signal.sh",
          "symbol": "help_submit_compute_signal",
          "parameter": "csv_fil_in",
          "owner": "PARAMETER.DESCRIPTIONS",
          "evidence": "Parameters row for 'csv_fil_in': Comma-separated list of input file paths for BAM or CRAM files."
        }
      ],
      "local_meanings": [],
      "status": "registered_shared"
    },
    {
      "id": "shared_fil_out",
      "parameter": "fil_out",
      "canonical_core": "Output file path.",
      "members": [
        {
          "surface_id": "bin/submit_compute_signal.sh::run_comp_sig",
          "path": "bin/submit_compute_signal.sh",
          "symbol": "run_comp_sig",
          "parameter": "fil_out",